{
  "protocolVersion": 1,
  "plugin": {
    "publisher": "example",
    "id": "third-format",
    "version": "0.1.0"
  },
  "permissions": [
    {
      "kind": "captured-input"
    }
  ],
  "components": [
    {
      "id": "worker",
      "scope": "project",
      "runtime": "javascript",
      "entrypoint": "component.mjs",
      "dependencies": [],
      "exit": {
        "stopTimeoutMs": 1000,
        "cleanupTimeoutMs": 1000
      }
    }
  ],
  "contributions": [
    {
      "id": "review-profile",
      "componentId": "worker",
      "contribution": {
        "kind": "resource",
        "schema": {
          "id": "tsumugi.review-declaration",
          "schemaVersion": 1,
          "behaviorVersion": 1
        },
        "path": "review-profile.json"
      }
    },
    {
      "id": "review-check",
      "componentId": "worker",
      "contribution": {
        "kind": "capability",
        "declaration": {
          "contract": {
            "id": "example.review-check",
            "schemaVersion": 1,
            "behaviorVersion": 1
          },
          "inputSchema": {
            "id": "tsumugi.review-check-input",
            "schemaVersion": 1,
            "behaviorVersion": 1
          },
          "outputSchema": {
            "id": "tsumugi.check-results",
            "schemaVersion": 1,
            "behaviorVersion": 1
          },
          "errorSchema": {
            "id": "tsumugi.review-check-error",
            "schemaVersion": 1,
            "behaviorVersion": 1
          },
          "profiles": [
            {
              "id": "example.plain-text",
              "schemaVersion": 1,
              "behaviorVersion": 1
            }
          ],
          "effect": "read-only",
          "permissions": [
            {
              "kind": "captured-input"
            }
          ],
          "limits": {
            "maxInputBytes": 4194304,
            "maxOutputBytes": 2097152,
            "concurrency": 1,
            "timeoutMs": 30000
          }
        }
      }
    }
  ]
}
