{
  "protocolVersion": 1,
  "plugin": {
    "publisher": "example",
    "id": "plain-text",
    "version": "0.1.0"
  },
  "permissions": [
    {
      "kind": "captured-input"
    }
  ],
  "components": [
    {
      "id": "worker",
      "scope": "project",
      "runtime": "javascript",
      "entrypoint": "component.mjs",
      "dependencies": [],
      "exit": {
        "stopTimeoutMs": 1000,
        "cleanupTimeoutMs": 1000
      }
    }
  ],
  "contributions": [
    {
      "id": "translation-profile",
      "componentId": "worker",
      "contribution": {
        "kind": "resource",
        "schema": {
          "id": "tsumugi.translation-import-declaration",
          "schemaVersion": 1,
          "behaviorVersion": 1
        },
        "path": "translation-profile.json"
      }
    },
    {
      "id": "extract",
      "componentId": "worker",
      "contribution": {
        "kind": "capability",
        "declaration": {
          "contract": {
            "id": "example.extract",
            "schemaVersion": 1,
            "behaviorVersion": 1
          },
          "inputSchema": {
            "id": "tsumugi.translation-extraction-input",
            "schemaVersion": 1,
            "behaviorVersion": 1
          },
          "outputSchema": {
            "id": "tsumugi.translation-exchange",
            "schemaVersion": 1,
            "behaviorVersion": 1
          },
          "errorSchema": {
            "id": "tsumugi.source-extraction-error",
            "schemaVersion": 1,
            "behaviorVersion": 1
          },
          "profiles": [
            {
              "id": "sample-translations",
              "schemaVersion": 1,
              "behaviorVersion": 1
            }
          ],
          "effect": "proposal",
          "permissions": [
            {
              "kind": "captured-input"
            }
          ],
          "limits": {
            "maxInputBytes": 2097152,
            "maxOutputBytes": 2097152,
            "concurrency": 1,
            "timeoutMs": 30000
          }
        }
      }
    },
    {
      "id": "source-check",
      "componentId": "worker",
      "contribution": {
        "kind": "capability",
        "declaration": {
          "contract": {
            "id": "example.source-check",
            "schemaVersion": 1,
            "behaviorVersion": 1
          },
          "inputSchema": {
            "id": "tsumugi.translation-extraction-check-input",
            "schemaVersion": 1,
            "behaviorVersion": 1
          },
          "outputSchema": {
            "id": "tsumugi.check-results",
            "schemaVersion": 1,
            "behaviorVersion": 1
          },
          "errorSchema": {
            "id": "tsumugi.source-extraction-error",
            "schemaVersion": 1,
            "behaviorVersion": 1
          },
          "profiles": [
            {
              "id": "sample-translations",
              "schemaVersion": 1,
              "behaviorVersion": 1
            }
          ],
          "effect": "read-only",
          "permissions": [
            {
              "kind": "captured-input"
            }
          ],
          "limits": {
            "maxInputBytes": 4194304,
            "maxOutputBytes": 2097152,
            "concurrency": 1,
            "timeoutMs": 30000
          }
        }
      }
    }
  ]
}
